reference_no,record_type,ref_type,author1init,author1last,author2init,author2last,otherauthors,pubyr,reftitle,pubtitle,editors,publisher,pubcity,pubvol,pubno,firstpage,lastpage,publication_type,language,doi
10236,ref,occ,A.,Mancinelli,D.,Ferrandes,B. Coccia,2004,"Norian calcareous Algae from the Matese Mountains (northern Campania, Italy)",Facies,,NA,NA,50,,107,112,journal article,English,
7077,ref,occ,J.,McCall,B.,Rosen,J. Darrell,1994,Carbonate deposition in accretionary prism settings: Early Miocene coral limestones and corals of the Makran Mountain Range in southern Iran,Facies,,NA,NA,31,,141,178,journal article,English,
6863,ref,occ,E.,Moussavian,A.,Vecsei,,1995,"Paleocene reef sediments from the Maiella carbonate platform, Italy",Facies,,NA,NA,32,,213,222,journal article,English,
6823,ref,occ,T.,Nakazawa,,,,2001,"Carboniferous reef succession of the Panthalassan open-ocean setting: Example from Omi Limestone, Central Japan",Facies,,NA,NA,44,,183,210,journal article,English,
6826,ref,occ,J.,Nebelsick,D.,Bassi,K. Drobne,2000,"Microfacies analysis and palaeoenvironmental interpretation of Lower Oligocene, shallow-water carbonates (Gornji Grad beds, Slovenia)",Facies,,NA,NA,43,,157,176,journal article,English,
6824,ref,occ,F.,Neuweiler,M.,Mehdi,M. Wilmsen,2001,"Facies of Liassic sponge mounds, Central High Atlas, Morocco",Facies,,NA,NA,44,,243,264,journal article,English,
9766,ref,occ,S. A.,Nicol,,,,1987,"A Down-slope Upper Triassic Reef Mound: Aflenz Limestone, Hochschwab Mountains, Northern Calcareous Alps",Facies,,NA,NA,,16,23,36,journal article,English,
11671,ref,occ,N.,Olivier,C.,Carpentier,"B. Martin-Garin, B. Lathuilière, C. Gaillard, S. Ferry, P. Hantzpergue, J. Geister",2004,"Coral-microbialite reefs in pure carbonate versus mixed carbonate-siliciclastic depositional environments: the example of the Pagny-sur-Meuse section (Upper Jurassic, northeastern France)",Facies,,NA,NA,50,2,229,255,journal article,English,
11830,ref,occ,A.,Perez-Lopez,A. C.,Lopez-Garrido,"A. Marquez-Aliaga, C. S. de Galdeano, F. J. Garcia-Tortosa",2003,"Ladinian carbonates of the Cabo Cope Unit (Betic Cordillera, SE Spain): a Tethys-Malaguide palaeogeographic gateway",Facies,,NA,NA,48,,1,7,journal article,English,
7592,ref,occ,T.,Pfister,,,,1985,"Coral fauna and facies of the Oligocene friniging reef near Cairo Montenotte (Liguria, Northern Italy)",Facies,,NA,NA,13,,175,226,journal article,English,
6844,ref,occ,S.M.L.,Pohler,,,,1998,"Devonian carbonate buildup facies in an intra-oceanic island arc (Tamworth Belt, New South Wales, Australia)",Facies,,NA,NA,39,,1,34,journal article,English,
6857,ref,occ,U.,Rehfeld,G.,Ernst,,1998,Hydrozoan build-ups of Millepora irregularis sp. nov. and fungiid coral meadows of Cunnolites Alloiteau (Anthozoa) - palaeoecological and palaeoceanographical implications for the Upper Cretaceous of north Cantabria (northern Spain),Facies,,NA,NA,39,,125,138,journal article,English,
9711,ref,occ,J. W.,Reinhardt,,,,1988,"Uppermost Permian reefs and Permo-Triassic sedimentary facies from the southeastern margin of Sichuan Basin, China",Facies,,NA,NA,18,,231,288,journal article,English,
13263,ref,occ,A.,Remia,M.,Taviani,,2005,"Shallow-buried Pleistocene Madrepora-dominated coral mounds on a muddy continental slope, Tuscan Archipelago, NE Tyrrhenian Sea",Facies,,NA,NA,50,03-Apr,419,425,journal article,English,
9876,ref,occ,U.,Röhl,,,et al.,1991,"Upper Triassic Tethyan Carbonates off Northwest Australia (Wombat Plateau, ODP Leg 122)",Facies,,NA,NA,,25,211-252,,journal article,English,
11835,ref,occ,T.,Rüffer,V.,Zamparelli,,1997,Facies and biota of Anisian to Carnian carbonate platforms in the Northern Calcareous Alps (Tyrol and Bavaria),Facies,,NA,NA,37,,115,136,journal article,English,
11837,ref,occ,F.,Russo,C.,Neri,"A. Mastandrea, A. Baracca",1997,"The mud mound nature of the Cassian platform margins of the Dolomites. A case history: The Cipit boulders from Punta Grohmann (Sasso Piatto Massif, Northern Italy)",Facies,,NA,NA,36,,25,36,journal article,English,
6861,ref,occ,D.,Sanders,R. C.,Baron-Szabo,,1997,"Coral-rudist bioconstructions in the Upper Cretaceous Haidach section (Northern Calcaerous Alps, Austria)",Facies,,NA,NA,36,,69,90,journal article,English,
10282,ref,occ,P.,Schäfer,,,,1979,"Facies and Paleoecology of two Upper Triassic Reef-complexes of the Northern Calcareous Alps (""Upper Rhaetian"" Reef Limestones, Salzburg, Austria)",Facies,,NA,NA,1,,3,245,journal article,English,
10130,ref,occ,P.,Schäfer,B.,Senowbari-Daryan,,1982,The Upper Triassic Pantokrator Limestone of Hydra (Greece): An Example of a Prograding Reef Complex,Facies,,NA,NA,6,,147,164,journal article,English,
6884,ref,occ,D.,Schumann,,,,1995,Upper Cretaceous rudist and stromatoporid associations of Central Oman (Arabian Peninsula),Facies,,NA,NA,32,,189,202,journal article,English,
9924,ref,occ,B.,Senowbari-Daryan,,,,2003,"Micropaleontology of Limestone Beds within the Shotori Dolomite (Triassic) of Kuh-e Nayband, Tabas Area, East-Central Iran",Facies,,NA,NA,,48,115,126,journal article,English,
6872,ref,occ,B.,Senowbari-Daryan,D.,Matarangas,M. Vartis-Matarangas,1996,"Norian-Rhaetian reefs in Argolis Peninsula, Greece",Facies,,NA,NA,34,,77,82,journal article,English,
11155,ref,occ,B.,Senowbari-Daryan,J.K.,Rigby,,1988,"Upper Permian segmented sponges from Djebel Tebaga, Tunisia",Facies,,NA,NA,19,,171,250,journal article,English,
6738,ref,occ,B.,Senowbari-Daryan,R.,Zühlke,"T. Bechstädt, E. Flügel",1993,Anisian (Middle Triassic) buildups of the northern Dolomites (Italy): The recovery of reef communities after the Permian/Triassic crisis,Facies,,NA,NA,28,,181,256,journal article,English,
6821,ref,occ,J-w.,Shen,T.,Kawamura,,2001,Guadalupian algae-sponge reefs in siliciclastic environments – the reefs at Lengwu (South China) compared with the reef at Iwaizaki (Japan),Facies,,NA,NA,45,,137,156,journal article,English,
6860,ref,occ,J.-w.,Shen,C.-m.,Yu,H.-m. Bao,1997,"A Late Devonian (Famennian) Renalcis-Epihphyton reef at Zhaijian, Guilin, South China",Facies,,NA,NA,37,,195,210,journal article,English,
359,ref,occ,J.-W.,Shen,S-L.,Zhang,,1997,"A Late Devonian (Frasnian) Coral-Bafflestone Reef at Houshan in Guilin, South China",Facies,,NA,NA,37,,85,98,,English,
918,ref,occ,M. G.,Simoes,M.,Kowalewski,,1998,"Shell beds as paleoecological puzzles: a case study from the Upper Permian of the Parana Basin, Brazil",Facies,,NA,NA,38,,175,196,journal article,English,
6862,ref,occ,A.,Vecsei,E.,Moussavian,,1997,"Paleocene reefs on the Maiella Platform margin, Italy: An example of the effects of the Cretaceous/Tertiary boundary events on reefs and carbonate platforms",Facies,,NA,NA,36,,123,140,journal article,English,
6840,ref,occ,G. E.,Webb,,,,1999,"Youngest Early Carboniferous (late Visean) shallow-water patch reefs in eastern Australia (Rockhampton Group, Queensland): Combining micro- and macro-scale data",Facies,,NA,NA,41,,111,140,journal article,English,
6875,ref,occ,O.,Weidlich,H. W.,Flügel,,1995,"Upper Permian (Murghabian) rugose corals from Oman (Ba'id area, Saih Hatat): Community structure and contributions to reefbuilding processes",Facies,,NA,NA,33,,229,264,journal article,English,
7116,ref,occ,X.,Wu,,,,1989,"Carnian (Upper Triassic) sponge mounds of the northwestern Sichuan Basin, China: Stratigraphy, facies and paleoecology",Facies,,NA,NA,21,,171,188,journal article,English,
13677,ref,occ,C. C.,Albritton,,,,1942,"Dinosaur tracks near Comanche, Texas",Field & Laboratory,,NA,NA,10,2,160,181,journal article,English,
6922,ref,occ,J.,Riva,A. A.,Petryk,,1981,Graptolites from the Upper Ordovician and Lower Silurian of Anticosti Island and the position of the Ordovician-Silurian boundary,"Field meeting, Anticosti-Gaspé, Québec, 1981: IUGS Subcommssion on Silurian Stratigraphy, Ordovician-Silurian Boundary Working Group, Stratigraphy and Paleontology",,NA,NA,2,,159,164,guidebook,English,
2730,ref,occ,B.,Patterson,P. O.,McGrew,,1937,A soricid and two erinaceids from the White River Oligocene [Colorado],"Field Museum of Natural History, Geological Series",,NA,NA,6,18,245,272,journal article,English,
9776,ref,occ,J. G.,Armstrong-Ziegler,,,,1980,Amphibia and Reptilia from the Campanian of New Mexico,Fieldiana,,NA,NA,4,,1,39,journal article,English,
1235,ref,occ,J.,Clark,J. R.,Beerbower,,1967,"Geology, paleoecology, and paleoclimatology of the Chadron Formation",Fieldiana,,NA,NA,5,5,21,74,journal article,English,
7431,ref,occ,C. R. C.,Paul,,,,1971,Revision of the Holocystites fauna (Diploporita) of North America,Fieldiana Geology,,NA,NA,24,,1,166,serial monograph,English,
4741,ref,occ,P. R.,Crane,S.R.,Manchester,Dilcher D.L.,1990,"A Preliminary Survey of Fossil Leaves and Well-Preserved Reproductive Structures from the Sentinel Butte Formation (Paleocene) near Almont, North Dakota","Fieldiana, Geology, New Series",,NA,NA,20,,,,,English,
3596,ref,occ,R. M.,West,,,,1973,"Geology and mammalian paleontology of the New Fork-Big Sandy area, Sublette County, Wyoming",Fieldiana: Geology,,NA,NA,29,,,,journal article,English,
10497,ref,occ,D. A.,Croft,M.,Bond,"J. J. Flynn, M. Reguero, A. R. Wyss",2003,"Large archaeohyracids (Typotheria, Notoungulata) from central Chile and Patagonia including a revision of Archaeotypotherium",Fieldiana: Geology (New Series),,NA,NA,49,,Jan-38,,serial monograph,English,
786,ref,occ,R.,Zangerl,,,,1953,The vertebrate fauna of the Selma Formation of Alabama. Part III. The turtles of the family Protostegidae,Fieldiana: Geology Memoirs,,NA,NA,3,3,63,133,,English,
788,ref,occ,R.,Zangerl,,,,1960,The vertebrate fauna of the Selma Formation of Alabama. Part V. An advanced cheloniid sea turtle,Fieldiana: Geology Memoirs,,NA,NA,3,5,279,312,,English,
7644,ref,occ,R. E.,Molnar,,,,1980,A dinosaur from New Zealand,Fifth International Gondwana Symposium,,NA,NA,,,91,96,book/book chapter,English,
8650,ref,occ,J-M.,Cordy,B.,Bastin,"C. Ek, R. Geeraerts, A. Ozer, Y. Quinif, J. Thorez, M. Ulrix-Closset,",1992,"La Belle-Roche (Sprimont, Belgium): the oldest archaeological site in the Benelux. A Report on a field trip.","FIve Million Years, the Human adventure. Edited by M. Toussaint. E.R.A.U.L., Liege.",,NA,NA,56,,287,301,book/book chapter,,
11115,ref,occ,H. G.,Richards,K.V.W.,Palmer,,1953,"Eocene Mollusks from Citrus and Levy Counties, Florida",Florida Geological Survey Geological Bulletin,,NA,NA,,35,,,serial monograph,English,
11119,ref,occ,J. R.,DuBar,,,,1962,Neogene Biostratigraphy of the Charlotte Harbor Area in Southwestern Florida,Florida Geological Survey Geological Bulletin 43,,NA,NA,,,1,83,serial monograph,English,
9010,ref,occ,E. W.,Berry,,,,1917,"The fossil plants from Vero, Florida",Florida State Geological Survey Annual Report,,NA,NA,9,,19,33,journal article,English,
9009,ref,occ,O. P.,Hay,,,,1917,"Vertebrata mostly from Stratum No. 3, at Vero, Florida, together with descriptions of new species",Florida State Geological Survey Annual Report,,NA,NA,9,,43,68,journal article,English,
6892,ref,occ,K,Varszegi,,,,1961,Remains of Phyllopods from the Permian of the Mecsek Mountains,Foeldt. Koezl.,,NA,NA,91,2,,,,,
13401,ref,occ,M.,Kretzoi,,,,1953,A legidosebb magyar osemlos-lelet,Foldtani Kozlony,,NA,NA,83,07-Sep,273,277,journal article,,
6399,ref,occ,M,Mergl,,,,1988,"The Lower Ordovician (Tremadoc-Arenig) Leptembolon community in the Komarov area (SW part of Prague Basin, Bohemia)",Folia Musei Rerum Naturalium Bohemiae Occidentalis: Geologica,,NA,NA,24,,1,34,journal article,,
3794,ref,occ,R. J.,Zakrzewski,,,,1988,Preliminary report on fossil mammals from the Ogallala (Miocene) of north-central Kansas,"Fort Hays Studies, Science, third series",,NA,NA,10,,117,127,journal article,English,
4932,ref,occ,P. M.,Butler,M.,Greenwood,,1976,Elephant Shrews (Macroscelididae) from Olduvai and Makapansgat,Fossil Vertebrates of Africa,,NA,NA,4,,1,50,,English,
4771,ref,occ,S. C.,Coryndon,Y.,Coppens,,1973,"Preliminary report on Hippopotamidae (Mammalia, Artiodactyla) from the Plio-Pleistocene of the Lower Omo Basin, Ethiopia",Fossil Vertebrates of Africa,,NA,NA,3,,139,157,,English,
4948,ref,occ,P. H.,Greenwood,E. J.,Todd,,1970,Fish remains from Olduvai,Fossil Vertebrates of Africa,,NA,NA,2,,225,241,,English,
12833,ref,occ,M. L.,As-Saruri,P. J.,Whybrow,M. E. Collinson,1999,"Geology, fruits, seeds, and vertebrates (?Sirenia) from the Kaninah Formation (Middle Eocene), Republic of Yemen",Fossil Vertebrates of Arabia,,NA,NA,,,443,453,book/book chapter,English,
6322,ref,occ,B. G.,Baarli,,,,1995,Orthacean and strophomenid brachiopods from the Lower Silurian of the central Oslo Region,Fossils and Strata,,NA,NA,,39,1,93,serial monograph,English,
6126,ref,occ,M. G.,Bassett,L. R. M.,Cocks,,1974,A review of Silurian brachiopods from Gotland,Fossils and Strata,,NA,NA,,3,1,56,serial monograph,English,
6141,ref,occ,C. F.,Bergman,,,,1989,Silurian paulinitid polychaetes from Gotland,Fossils and Strata,,NA,NA,,25,1,128,serial monograph,English,
6142,ref,occ,M.,Bjerreskov,,,,1975,Llandoverian and Wenlockian graptolites from Bornholm,Fossils and Strata,,NA,NA,,8,1,93,serial monograph,English,
6137,ref,occ,S.,Stridsberg,,,,1985,Silurian oncocerid cephalopods from Gotland,Fossils and Strata,,NA,NA,,18,1,65,serial monograph,English,
6830,ref,occ,S. R.,Ash,,,,1975,The Chinle (Upper Triassic) flora of southeastern Utah,"Four Corners Geological Society Guidebook, 8th Field Conference, Canyonlands",,NA,NA,,,143,147,guidebook,English,
11645,ref,occ,A,Vörös,,,J. Pálfy,2002,"New Stratigraphy of the Pelsonian Substage at Köveskál (Middle Triassic, Balaton Highland, Hungary)",Fragmenta Palaeonotlogica Hungarica,,NA,NA,20,,,,journal article,,
13414,ref,occ,L.,Kordos,,,,2002,"Eocene sea cows (Sirenia, Mammalia) from Hungary",Fragmenta Palaeontologica Hungarica,,NA,NA,20,,43,48,journal article,,
4295,ref,occ,W. H.,Gillespie,H. W.,Pfefferkorn,,1976,Plant Fossils in Early & Middle Parts of the Proposed Pennsylvanian System Stratotype in West Virginia,G.S.A. Field Trip Guidebook No. 3,,NA,NA,,,,,guidebook,English,
9124,ref,occ,M.,Aretz,,,,2002,"Rugose corals and associated carbonate microfossils from the Brigantian (Mississippian) of Catelsec (Montagne Noire, southern France)",Géobios,,NA,NA,35,,187,200,journal article,English,
9364,ref,occ,A.,Arribas,P.,Palmqvist,,1998,"Taphonomy and palaeoecology of an assemblage of large mammals: hyaenid activity in the Lower Pleistocene site at Venta MIcena (Orce, Guadix-Baza basin, Granada, Spain)",Géobios,,NA,NA,31,3,1,47,journal article,English,
12087,ref,occ,R. B.,Blodgett,J.,Frýda,P.R. Racheboeuf,2003,"Murchisonia gourvenneci, new name for Muchisonia oehlerti Blodgett, Frýda and Racheboeuf, 1999",Géobios,,NA,NA,36,5,503,503,journal article,English,
13372,ref,occ,G. A.,Brock,,,,1998,"Middle Cambrian molluscs from the southern New England fold belt, New South Wales, Australia",Géobios,,NA,NA,31,5,571,586,journal article,English,
6621,ref,occ,K.,Brood,,,,1976,Cyclostomatous Bryozoa from the Paleocene and Maastrichtian of Majunga basin Madagascar,Géobios,,NA,NA,9,4,393,408,journal article,English,
9669,ref,occ,E.,Buffetaut,R.,Ingavat,,1983,"<i>Goniopholis phuwiangensis</i> nov. sp., a new mesosuchian crocodilian from the Mesozoic of northeastern Thailiand",Géobios,,NA,NA,16,1,79,91,journal article,English,
9704,ref,occ,E.,Buffetaut,R.,Ingavat,,1980,"A new crocodilian from the Jurassic of Thailand, <i>Sunosuchus thailandicus</i> n. sp. (Mesosuchia, Goniopholididae), and the palaeogeographical history of south-east Asia in the Mesozoic",Géobios,,NA,NA,13,6,879,889,journal article,English,
11171,ref,occ,Z,Chen,N. W.,Archibold,,2000,"Tournaisian-Visean brachiopods from the Gancaohu area of southern Tienshan Mountains, Xinjiang, NW China",Géobios,,NA,NA,33,2,183,199,journal article,English,
10156,ref,occ,H.,Cremer,,,,1995,"Spicule Pseudomorphs in Upper Triassic (Norian) Chaetetid Sponges from the Western Taurids (Antalya-Region, SW Turkey)",Géobios,,NA,NA,28,2,163,174,journal article,English,
7685,ref,occ,G.M.A.,El-Asa'ad,,,,1991,Oxfordian hermatypic corals from central Saudi Arabia,Géobios,,NA,NA,24,3,267,287,journal article,English,
9339,ref,occ,R.,Fischer,C.,Galli Oliver,J. Reitner,1989,"Skeletal structure growth and paleoecology of the patch reef-building polychaete worm Diplochaetetes mexicanus Wilson, 1986 from the Oligocene of Baja California (Mexico)",Géobios,,NA,NA,22,5,761,775,journal article,English,
12698,ref,occ,P. M.,Galton,,,,1980,"Partial skeleton of Dracopelta zbyszewskii n. gen. and n. sp., an ankylosaurian dinosaur from the Upper Jurassic of Portugal",Géobios,,NA,NA,13,3,451,457,journal article,English,
12234,ref,occ,P. M.,Galton,H. P.,Powell,,1983,"Stegosaurian dinosaurs from the Bathonian (Middle Jurassic) of England, the earliest record of the family Stegosauridae",Géobios,,NA,NA,16,2,219,229,journal article,English,
9521,ref,occ,P. M.,Galton,J.,Van Heerden,,1985,"Partial hindlimb of <i>Blikanasaurus cromptoni</i> n. gen. and n. sp., representing a new family of prosauropod dinosaurs from the Upper Triassic of South Africa",Géobios,,NA,NA,18,4,509,516,journal article,English,
9787,ref,occ,V. J.,Gupta,,,,1984,"Plio-Pleistocene mammals from Gidhniya village, Western Nepal",Géobios,,NA,NA,17,4,493,497,journal article,English,
12999,ref,occ,J.,Kriwet,,,,2005,"An amioid fish (Neopterygii, Amiiformes) from the Late Jurassic of the Iberian peninsula",Géobios,,NA,NA,38,,99,106,journal article,English,
8552,ref,occ,M,Kutscher,L,Villier,,2003,"Ophiuroid remains from the Toarcian of Sainte-Verge (Deux-Sevres, France): paleobiological perspectives",Géobios,,NA,NA,36,2,179,194,journal article,English,
11655,ref,occ,A.,Marquez-Aliaga,C.C.,Emig,J.M. Brito,1999,Triassic lingulide brachiopods from the Iberian Range (Spain),Géobios,,NA,NA,32,6,815,821,journal article,English,
278,ref,occ,J. -P.,Masse,,,"M. Gallo Maresca, E. Luperto Sinni",1998,"Albian rudist faunas from southern Italy: taxonomic, biostratigraphic, and palaeobiogeographic aspects",Géobios,,NA,NA,31,1,47,59,,English,
373,ref,occ,I.,Mendez-Bedia,F.,Soto,,1984,"Paleoecological succession in a Devonian organic buildup (Moniello Fm., Cantabrian Mountains, NW Spain)",Géobios,,NA,NA,8,,151,157,,English,
10605,ref,occ,D,Néraudeau,A,Crame,M Kooser,2000,"Upper Cretaceous echinoids from James Ross Basin, Antarctica",Géobios,,NA,NA,33,4,455,466,journal article,English,
12998,ref,occ,A.,Osi,,,,2004,"The first dinosaur remains from the Upper Cretaceous of Hungary (Csehbánya Formation, Bakony Mts)",Géobios,,NA,NA,37,,749,753,journal article,English,
13505,ref,occ,J. L.,Sanz,A. D.,Buscalioni,,1994,,"Géobios, Mémoire Spéciale",,NA,NA,16,,213,217,journal article,,
9086,ref,occ,M.,Mohanti,S. C.,Srivastava,,1994,Oligocene reefal environment of Kutch Basin (western India) with implications of the Mediterranean connection,Géologie Méditerranéenne,,NA,NA,21,03-Apr,127,129,journal article,,
9872,ref,occ,B,Senowbari-Daryan,,,,1996,Upper Triassic Reefs and Reef communities of Iran,"Göttinger Arbeiten zur Geologie und Paläontologie, Sb",,NA,NA,,2,299,304,journal article,,
9636,ref,occ,O. W. M.,Rauhut,A.,Hungerbühler,,2000,A review of European Triassic theropods,GAIA,,NA,NA,15,,75,88,journal article,English,
10337,ref,occ,T. H.,Rich,P. J.,Vickers-Rich,"F. E. Novas, R. Cuneo, P. Puerta, R. Vacca",1998,"Theropods from the ""Middle"" Cretaceous Chubut Group of the San Jorge Sedimentary Basin, central Patagonia. A preliminary note",GAIA,,NA,NA,15,,111,115,journal article,English,
7895,ref,occ,T.,Thulborn,,,,1998,Australia's earliest theropods: footprint evidence in the Ipswich Coal Measures (Upper Triassic) of Queensland,GAIA,,NA,NA,15,,301,311,journal article,English,
12086,ref,occ,J.,Perner,,,,1907,,"Gastéropodes, Tome 2: Pleurotomaridae et Murchisonidae",,NA,NA,,,1,380,book/book chapter,,
6532,ref,occ,A. L.,Nauss,P.L.,Smith,,1989,"Lithiotis (Bivalvia) bioherms, Lower Jurassic, Oregon","Geldsetzer, H.H.J., James, N.P., Tebbutt, G.E. (eds.): Reefs - Canada and adjacent areas. Canadian Society of Petroleum Geologists Memoir",,NA,NA,13,,738,740,book/book chapter,English,
6793,ref,occ,F. M.,Swartz,,,,1965,"Guide to the Horse Shoe curve Section between Altoona and Gallitzin, Central Pennsylvania",General Geology Report G50,,NA,NA,,G50,1,56,serial monograph,English,
4787,ref,occ,T. S.,Lovejoy,R.O.,"Bierregaard, Jr.",,1990,Central Amazonian Forests and the Minimum Crtical Size of Ecosystems Project,"Gentry, A.H., ed.",,NA,NA,,,60,71,,English,
4796,ref,occ,E. G.,Leigh,S.J.,Wright,,1990,Barro Colorado Island and Tropical Biology,"Gentry, A.H., ed., Four Neotropical Rainforests, Yale University Press, New Haven",,NA,NA,,,28,47,,English,
4790,ref,occ,J.,Terborgh,,,,1990,An Overview of Research at Cocha Cashu Biological Station,"Gentry, A.H., Four Neotropical Rainforests, Yale University Press, New Haven",,NA,NA,,,48,59,,English,
11377,ref,occ,N.,Goren-Inbar,S.,Belitzky,"Y. Goren, R. Rabinovich, I. Saragusti",1992,"Gesher Benot Ya'aqov - the ""Bar"": an Acheulean Assemblage.",Geoarchaeology,,NA,NA,7,1,27,40,journal article,English,
11397,ref,occ,M. C.,Stiner,G.,Arsebuk,F. C. Howell,1996,"Cave bears and paleolithic artifacts in Yarimburgaz Cave, Turkey: Dissecting a palimpsest",Geoarchaeology,,NA,NA,11,4,279,327,journal article,English,
6931,ref,occ,B.,Cornet,,,,1977,"Preliminary investigations of two Late Triassic conifers from York County, Pennsylvania",Geobotany,,NA,NA,,,,,book/book chapter,English,
10407,ref,occ,A.,Badiola,H.,Astibia,"X. Pereda Suberbiola, X. Murelaga",2002,"First record of the genus Leptolophus Remy, 1965 (Mammalia, Perissodactyla) in the late Eocene (Priabonian) of Europe",Geodiversitas,,NA,NA,24,4,841,848,journal article,English,
7057,ref,occ,P. J.,Currie,K.,Carpenter,,2000,"A new specimen of <i>Acrocanthosaurus atokensis</i> (Theropoda, Dinosauria) from the Lower Cretaceous Antlers Formation (Lower Cretaceous, Aptian) of Oklahoma, USA",Geodiversitas,,NA,NA,22,2,207,246,journal article,English,
7864,ref,occ,I. G.,Danilov,A. O.,Averianov,,1999,"A new species of Calamagras Cope 1873 (Serpentes, Boidae, Erycinae) from the early Eocene of Kirghizia.",Geodiversitas,,NA,NA,21,1,85,91,journal article,English,
10946,ref,occ,A.,Forsten,S.,Sharapov,,2000,"Fossil equids (Mammalia, Equidae) from the Neogene and Pleistocene of Tadzhikistan",Geodiversitas,,NA,NA,22,2,293,314,journal article,English,
7375,ref,occ,M.,Ivanov,,,,2000,"Snakes of the lower/middle Miocene transition at Vieux Collonges (Rhône, France), with comments on the colonisation of western Europe by colubroids.",Geodiversitas,,NA,NA,22,4,559,588,journal article,English,
9585,ref,occ,A.,Janoo,S.,Sen,,1988,"Pliocene vertebrate locality of Calta, Ankara, Turkey. 2. Aves: Struthionidae",Geodiversitas,,NA,NA,20,3,339,351,journal article,English,
12867,ref,occ,J.-C.,Rage,S.,Bajpai,"J. G. M. Thewissen, B. N. Tiwari",2003,"Early Eocene snakes from Kutch, western India, with a review of the Palaeophiidae.",Geodiversitas,,NA,NA,25,4,695,716,journal article,English,
9586,ref,occ,S.,Sen,,,,1998,"Pliocene vertebrate locality of Calta, Ankara, Turkey. 4. Rodentia and Lagomorpha",Geodiversitas,,NA,NA,20,3,359,378,journal article,English,
9032,ref,occ,S.,Sen,G.,Bouvrain,D. Geraads,1998,"Pliocene vertebrate locality of Calta, Ankara, Turkey. 12. Paleoecology, biogeography and biochronology",Geodiversitas,,NA,NA,20,3,497,510,journal article,English,
12949,ref,occ,S.,Gordillo,A.E.,Aitken,,2000,"Palaeoenvironmental interpretation of Late Quaternary marine molluscan assemblages, Canadian Arctic achipelago",Geographie physique et Quaternaire,,NA,NA,54,3,301,315,journal article,,
4490,ref,occ,G. M.,Rex,A.C.,Scott,,1987,"The Sedimentology, Palaeoecology and Preservation of the Lower Carboniferous Plant Deposits at Pettycur, Fife, Scotland",Geol. Mag.,,NA,NA,124,,43,66,,English,
5282,ref,occ,M. D.,Leakey,R. L.,Hay,"G. Curtis, R. Drake, M. Jackes, T. White",1978,"Fossil hominids from the Laetolil Beds,Tanzania","Geol.background to fossil man,recent research in the Gregory Rift valley,east Africa,W.Bishop(ed.)",,NA,NA,i-xii,,157,170,,English,
6576,ref,occ,B.,Hamdi,A. YU.,Rozanov,A. YU. Zhuravlev,1995,Latest Middle Cambrian metazoan reef from northern Iran,Geol.Mg.,,NA,NA,132,4,367,373,journal article,English,
4240,ref,occ,M. C.,Stopes,,,,1914,"The ""Fern Ledges"" Carboniferous Flora of St. John, New Brunswick",Geologic Survey,,NA,NA,41,38,1,142,book/book chapter,English,
7061,ref,occ,O.,Dragastan,D. K.,Richter,,2001,Non-marine calcareous algae of Upper Jurassic to Lower Cretaceous sequences from the Weserbergland (northwest Germany),Geologica Carpathica,,NA,NA,52,5,301,318,journal article,English,
11704,ref,occ,M.,Kochanova,J.,Michalik,,1986,Stratigraphy and macrofauna of the Zámostie limestones (upper Pelsonian-lower Illyrian) of the Choc Nappe at the southern slopes of the Nizke Tatry Mts. (West Carpathians),Geologica Carpathica,,NA,NA,37,4,501,531,journal article,English,
11027,ref,occ,L. H,Peza,J,Zitt,,2002,Urgonian (Early Cretaceous) echinoids of the Mirdita zone (Southern Albania),Geologica Carpathica,,NA,NA,53,5,327,332,,English,
11332,ref,occ,E.,Roniewicz,J.,Michalík,,1998,Rhaetian Scleractinian Corals in the Western Carpathians,Geologica Carpathica,,NA,NA,49,6,391,399,journal article,English,
8843,ref,occ,K.,Zagorsek,,,,1993,"New Anisian (Middle Triassic) Bryozoa (Trepostomata) from the Vysoka Formation (Male Karpaty Mts., western Carpathians) Slovakia",Geologica Carpathica,,NA,NA,44,1,49,58,journal article,English,
7449,ref,occ,F. M.,Dalla Vecchia,,,,1998,"Remains of Sauropoda (Reptilia, Saurischia) in the Lower Cretaceous (Upper Hauterivian/Lower Barremian) limestones of SW Istria (Croatia)",Geologica Croatica,,NA,NA,51,2,105,134,journal article,English,
