reference_no,record_type,ref_type,author1init,author1last,author2init,author2last,otherauthors,pubyr,reftitle,pubtitle,editors,publisher,pubcity,pubvol,pubno,firstpage,lastpage,publication_type,language,doi
13204,ref,occ,F. E.,Novas,,,,1998,"Megaraptor namunhuaiquii, gen. et sp. nov., a large-clawed, Late Cretaceous theropod from Patagonia",Journal of Vertebrate Paleontology,,NA,NA,18,1,4,9,journal article,English,
13089,ref,occ,O. W. M.,Rauhut,X.,Xu,,2005,"The small theropod dinosaurs Tugulusaurus and Phaedrolosaurus from the Early Cretaceous of Xinjiang, China",Journal of Vertebrate Paleontology,,NA,NA,25,1,107,118,journal article,English,
2938,ref,occ,K. L.,Rogers,,,,1987,Pleistocene high altitude amphibians and reptiles from Colorado (Alamosa Local Fauna; Pleistocene; Irvingtonian),Journal of Vertebrate Paleontology,,NA,NA,7,1,82,95,journal article,English,
12924,ref,occ,R. R.,Rogers,,,,1992,"Non-marine borings in dinosaur bones from the Upper Cretaceous Two Medicine Formation, northwestern Montana",Journal of Vertebrate Paleontology,,NA,NA,12,4,527,531,journal article,English,
2960,ref,occ,K. D.,Rose,,,,1999,"Postcranial skeleton of Eocene Leptictidae (Mammalia), and its implications for behavior and relationships",Journal of Vertebrate Paleontology,,NA,NA,19,2,355,372,journal article,English,
2976,ref,occ,K. D.,Rose,S. G.,Lucas,,2000,"An early Paleocene palaeanodont (Mammalia, ?Pholidota) from New Mexico, and the origin of Palaeanodonta",Journal of Vertebrate Paleontology,,NA,NA,20,1,139,156,journal article,English,
9476,ref,occ,T.,Rowe,,,,1989,A new species of the theropod dinosaur <i>Syntarsus</i> from the Early Jurassic Kayenta Formation of Arizona,Journal of Vertebrate Paleontology,,NA,NA,9,2,125,136,journal article,English,
2988,ref,occ,T.,Rowe,R. L.,Cifelli,"T. M. Lehman, A. Weil",1992,"The Campanian Terlingua local fauna, with a summary of other vertebrates from the Aguja Formation, Trans-Pecos Texas",Journal of Vertebrate Paleontology,,NA,NA,12,4,472,493,journal article,English,
8729,ref,occ,S. D.,Sampson,,,,1995,Two new horned dinosaurs from the upper Cretaceous Two Medicine Formation of Montana; with a phylogenetic analysis of the Centrosaurinae (Ornithischia: Ceratopsidae),Journal of Vertebrate Paleontology,,NA,NA,14,5,743,760,journal article,English,
8731,ref,occ,S. D.,Sampson,D. W.,Krause,"P. Dodson, C. A. Forster",1996,"The premaxilla of <i>Majungasaurus</i> (Dinosauria: Theropoda), with implications for Gondwanan paleobiogeography",Journal of Vertebrate Paleontology,,NA,NA,16,4,601,605,journal article,English,
13400,ref,occ,R. J. G.,Savage,D. P.,Domning,J. G. M. Thewissen,1994,"Fossil Sirenia of the West Atlantic and Caribbean region. V. The most primitive known sirenian, Prorastomus sirenoides Owen, 1855",Journal of Vertebrate Paleontology,,NA,NA,14,3,427,449,journal article,English,
13584,ref,occ,P. C.,Sereno,S.,Chao,,1988,"Psittacosaurus xinjiangensis (Ornithischia: Ceratopsia), a new psittacosaur from the Lower Cretaceous of northwestern China",Journal of Vertebrate Paleontology,,NA,NA,8,4,353,365,journal article,English,
3310,ref,occ,J. E.,Storer,,,,1991,"The mammals of the Gryde Local Fauna, Frenchman Formation (Maastrichtian: Lancian), Saskatchewan",Journal of Vertebrate Paleontology,,NA,NA,11,3,350,369,journal article,English,
7923,ref,occ,H-D.,Sues,P. E.,Olsen,,1993,"A new procolophonid and a new tetrapod of uncertain, possibly procolophonian affinities from the Upper Triassic of Virginia",Journal of Vertebrate Paleontology,,NA,NA,13,3,282,286,journal article,English,
12365,ref,occ,H.-D.,Sues,,,,1985,First record of the tritylodontid Oligokyphus (Synapsida) from the Lower Jurassic of western North America,Journal of Vertebrate Paleontology,,NA,NA,5,4,328,335,journal article,English,
7684,ref,occ,H.-D.,Sues,E.,Frey,"D. M. Martill, D. M. Scott",2002,"<i>Irritator challengeri</i>, a spinosaurid (Dinosauria: Theropoda) from the Lower Cretaceous of Brazil",Journal of Vertebrate Paleontology,,NA,NA,22,3,535,547,journal article,English,
9955,ref,occ,G.,Suwa,H.,Nakaya,"B. Asfaw, H. Saegusa, A. Amzaye, R. T. Kono, Y. Beyene, S. Katoh",2003,"Plio-Pleistocene terrestrial mammal assemblage from Konso, Southern Ethiopia",Journal of Vertebrate Paleontology,,NA,NA,23,4,901,916,journal article,English,
13113,ref,occ,Z.,Szyndlar,,,,1994,Oligocene snakes of southern Germany.,Journal of Vertebrate Paleontology,,NA,NA,14,1,24,37,journal article,English,
12369,ref,occ,R. S.,Tykoski,T. B.,Rowe,"R. A. Ketcham, M. W. Colbert",2002,"Calsoyasuchus valliceps, a new crocodyliform from the Early Jurassic Kayenta Formation of Arizona",Journal of Vertebrate Paleontology,,NA,NA,22,3,593,611,journal article,English,
12165,ref,occ,M. D.,Uhen,G.,Tichy,,2000,A new basilosaurid archaeocete from Austria,Journal of Vertebrate Paleontology,,NA,NA,20,3,74A,75A,abstract,English,
5724,ref,occ,D. J.,Varricchio,,,,1993,"Taphonomy of Jack's Birthday site, a diverse dinosaur bone bed",Journal of Vertebrate Paleontology,,NA,NA,13,"3, suppl.",61A,,abstract,English,
5717,ref,occ,J. W.,Westgate,,,,1989,"Mass occurence of the giant gopher tortoise (Gopherus hexagonatus) in the late Pleistocene, Beaumont Formation, Willacy County, Texas",Journal of Vertebrate Paleontology,,NA,NA,9,Supplement,44A.,,abstract,English,
5571,ref,occ,A. J.,Winkler,,,,1988,"The Neogene rodent succession of the Baringo Basin, Kenya",Journal of Vertebrate Paleontology,,NA,NA,8,"3,Suppl.",29A.,,abstract,English,
10299,ref,occ,A. R.,Wyss,M. A.,Norell,"J. J. Flynn, M. J. Novacek, R. Charrier, M. C. McKenna, C. C. Swisher III, D. Frassinetti, P. Salinas, M. Jin",1990,A new early Tertiary mammal fauna from central Chile: implications for Andean stratigraphy and tectonics,Journal of Vertebrate Paleontology,,NA,NA,10,4,518,522,journal article,English,
10499,ref,occ,A. R.,Wyss,M. A.,Norell,"M. J. Novacek, J. J. Flynn",1992,New ?early Tertiary localities from the Chilean Andes,Journal of Vertebrate Paleontology,,NA,NA,12,3 Supp.,61A,,abstract,English,
8811,ref,occ,I. S.,Zalmout,H. A.,Mustafa,P. D. Gingerich,2000,Priabonian Basilosaurus isis (Cetacea) from the Wadi Esh-Shallala Formation: First marine mammal from the Eocene of Jordan,Journal of Vertebrate Paleontology,,NA,NA,20,1,201,204,journal article,English,
4107,ref,occ,S. H.,Mamay,,,,1954,A Permian Discinites cone,Journal of Washington Academy of Science,,NA,NA,44,,7,11,journal article,English,
5512,ref,occ,R. F.,Ewer,,,,1958,The fossil suidae of Makapansgat,Journal of Zoology,,NA,NA,130,3,329,371,,English,
4132,ref,occ,P. A.,Spurgeon,J. R.,Jennings,,1985,"Pennsylvanian plants of eastern Kentucky: A flora from the Breathitt Formation near Grannies Branch and Rocky Branch of Goose Creek, Clay County, Kentucky","Kentucky Geological Survey Rept. Inv. 3, Series 11",,NA,NA,,,,,journal article,English,
5330,ref,occ,G.,Williamson,,,,1990,New orchids from the flora Zambesiaca (Africa) region,Kirkia,,NA,NA,13,2,245,252,,,
640,ref,occ,J. K.,Hannibal,R. M.,Feldmann,,1996,Caryocaris (Crustacea: Phyllocarida) from the Ordovician of the Cordillera Oriental of Southern Bolivia,Kirklandia,,NA,NA,49,,7,11,,,
4850,ref,occ,H. B. S.,Cooke,,,,1978,"Pliocene-Pleistocene Suidae from Hadar, Ethiopia",Kirtlandia,,NA,NA,29,,1,63,,,
275,ref,occ,G.,Lindström,,,,1884,The Silurian Gastropoda and Pteropoda of Gotland,Kongliga Svenska Vetenskaps-Akademiens Handlingasr,,NA,NA,19,,1,250,,,
10211,ref,occ,H. T.,Bunn,,,,1997,The bone assemblages from the excavated sites,Koobi Fora Research Project: Plio-Pleistoene Archaeology,,NA,NA,5,,402,458,book/book chapter,,
10208,ref,occ,J. W. K.,Harris,G. Ll.,Isaac,Z. M. Kaufulu,1997,"Sites in the Upper KBS, Okote, and Chari Members: Reports",Koobi Fora Research Project: Plio-Pleistoene Archaeology,,NA,NA,5,,115,236,book/book chapter,,
10318,ref,occ,J. M.,Harris,,,,1991,Family Hippopotamidae,"Koobi Fora Research Project: The Fossil Ungulates: Geology, Fossil Artiodactyls, and Palaeoenvironments",,NA,NA,3,,31,85,book/book chapter,,
10319,ref,occ,J. M.,Harris,,,,1991,Family Camelidae,"Koobi Fora Research Project: The Fossil Ungulates: Geology, Fossil Artiodactyls, and Palaeoenvironments",,NA,NA,3,,86,92,book/book chapter,,
10320,ref,occ,J. M.,Harris,,,,1991,Family Giraffidae,"Koobi Fora Research Project: The Fossil Ungulates: Geology, Fossil Artiodactyls, and Palaeoenvironments",,NA,NA,3,,93,138,book/book chapter,,
10321,ref,occ,J. M.,Harris,,,,1991,Family Bovidae,"Koobi Fora Research Project: The Fossil Ungulates: Geology, Fossil Artiodactyls, and Palaeoenvironments",,NA,NA,3,,139,320,book/book chapter,,
10215,ref,occ,M.,Beden,,,,1983,Family Elephantidae,"Koobi Fora Research Project: The Fossil Ungulates: Proboscidea, Perissodactyla, and Suidae",,NA,NA,2,,40,129,book/book chapter,,
10216,ref,occ,V.,Eisenmann,,,,1983,Family Equidae,"Koobi Fora Research Project: The Fossil Ungulates: Proboscidea, Perissodactyla, and Suidae",,NA,NA,2,,156,214,book/book chapter,,
10214,ref,occ,J. M.,Harris,,,,1983,Family Deinotheriidae,"Koobi Fora Research Project: The Fossil Ungulates: Proboscidea, Perissodactyla, and Suidae",,NA,NA,2,,22,39,book/book chapter,,
10217,ref,occ,J. M.,Harris,,,,1983,Family Suidae,"Koobi Fora Research Project: The Fossil Ungulates: Proboscidea, Perissodactyla, and Suidae",,NA,NA,2,,215,302,book/book chapter,,
10231,ref,occ,J. M.,Harris,,,,1983,Family Rhinocerotidae,"Koobi Fora Research Project: The Fossil Ungulates: Proboscidea, Perissodactyla, and Suidae",,NA,NA,2,,130,155,book/book chapter,,
6491,ref,occ,T. G.,Halle,,,,1916,Lower Devonian Plants from Roragen in Norway,Kungl. Svenska Vetenskapsakademiens Handlingar,,NA,NA,57,1,,,serial monograph,,
8394,ref,occ,A. B.,Lundblad,,,,1950,"Studies in the Rhaeto-Liassic Floras of Sweden I (Pteridophyta, Pteridospermae, and Cycadophyta from the mining district of NW Scania)",Kungl. Svenska Vetenskapsakademiens Handlingar,,NA,NA,1,8,1,82,journal article,,
8415,ref,occ,AB,Lundblad,,,,1959,Studies in the Rhaeto-Liassic Floras of Sweden II (Ginkgophyta from the mining district of NW Scania),Kungl. Svenska Vetenskapsakademiens Handlingar. Fjaerde Serien,,NA,NA,6,2,1,38,journal article,,
8432,ref,occ,E.,Stworzewicz,A.,Szynkiewicz,,1989,Miocenskie slimaki ladowe we wschodniej czesci odkrywki KWB Belchatow [Miocene land snails from eastern part of Belchatow Brown Coal delf.],Kwartalink Geologiczny,,NA,NA,32,03-Apr,655,662,journal article,,
8134,ref,occ,D.S.,Lee,,,,1988,Geology of Korea,"Kyohak-Sa Publishing Company, Seoul, South Korea",,NA,NA,,,1,514,book/book chapter,,
5584,ref,occ,F. L.,Van Noten,B.A.,Wood,,1985,"A new hominid from Baringo,Kenya",LAnthropologie,,NA,NA,89,1,141,143,,,
3887,ref,occ,J. S.,Hollingsworth,,,,1999,Proposed stratotype section and point for the base of the Dyeran Stage,Laurentai 99: V field conference of the Cambrian Stage and Subdivision,,NA,NA,,,38,42,journal article,,
3913,ref,occ,L. B.,McCollum,F. A.,Sundberg,,1999,"Biostratigraphy of the traditional Lower-Middle Cambrian boundary interval in the outher shelf Emigrant Formation, Split Mountain East Section, Esmeralda County, Nevada","Laurentai 99: V field conference of the Cambrian Stage Subdivision Working Group, International Subcomission on Cambrian Stratigraphy",,NA,NA,,,29,34,journal article,,
3889,ref,occ,A. R.,Palmer,,,,1999,"Stratotype boundary of the Steptoean Stage, McGill Nevada","Laurentai 99: V field conference of the Cambrian Stage Subdivision Working Group, International Subcomission on Cambrian Stratigraphy",,NA,NA,,,22,23,journal article,,
3901,ref,occ,J. S.,Hollingsworth,,,,1999,A second candidate position for the base of the Montezuman,"Laurentai 99: V field conference of the Cambrian Stage Subdivision Working Group, International Subcommission on Cambrian Stratigraphy",,NA,NA,,,42,46,journal article,,
3890,ref,occ,R. A.,Robison,,,,1999,Contact between Swassey Limestone and Wheeler Shale and the gibbus/atavus boundary,Laurentia 00: V field conference of the Cambrian Stage Subdivision Working Group; International Subcomission on Cambrian Stratigraphy,,NA,NA,,,21,22,journal article,,
3929,ref,occ,E. D.,Fowler,,,,1999,"Biostratigraphy of upper Dyeran strata of the Carrara Formation, Emigrant Pass, Nopah Range, California","Laurentia 99:  V field conference of the Cambrian Stage Subdivision Working Group, International Subcomission on Cambrian Stratigraphy",,NA,NA,,,46,50,journal article,,
3906,ref,occ,R. A.,Robison,,,,1999,"Base of Ptychagnostus atabus Zone, candidate stratotype for base of unnamed international series","Laurentia 99:  V field conference of the Cambrian Stage Subdivision Working Group, International Subcomission on Cambrian Stratigraphy",,NA,NA,,,15,17,journal article,,
3910,ref,occ,J. S.,Hollingsworth,,,,1999,A candidate position for the base of the Montezuman stage,"Laurentia 99: V field conference of the Cambrian Stage Subdivision Working Group, International Subcomission on Cambrian Stratigraphy",,NA,NA,,,34,37,journal article,,
3903,ref,occ,A. R.,Palmer,,,,1999,"Ruin Wash, Chief Range Nevada","Laurentia 99: V field conference of the Cambrian Stage Subdivision Working Group, International Subcomission on Cambrian Stratigraphy",,NA,NA,,,24,25,journal article,,
3907,ref,occ,A. R.,Palmer,,,,1999,"Oak Springs Summit section, type locality for the base of the Delamaran Stage","Laurentia 99: V field conference of the Cambrian Stage Subdivision Working Group, International Subcomission on Cambrian Stratigraphy",,NA,NA,,,26,28,journal article,,
3898,ref,occ,F. A.,Sundberg,,,,1999,Candidate stratotype for base of Marjuman Stage,"Laurentia 99: V field conference of the Cambrian Stage Subdivision Working Group, International Subcomission on Cambrian Stratigraphy",,NA,NA,,,10,15,journal article,,
3897,ref,occ,J. S.,Hollingsworth,,,,1999,The problematical base of the Montezuman Stages: should the Laurentian Fallotaspidids be in a non-trilobite series,"Laurentia 99: V field conference of the Cambrian Stage Subdivision Working Group, International Subcommission on Cambrian Stratigraphy",,NA,NA,,,5,9,journal article,,
3908,ref,occ,R. A.,Robison,,,,1999,Lithology and faunas of the Lejopyge calva Zone,"Laurentia 99: V fields conference of the Cambrian Stage Subdivision Working Group, International Subcomission on Cambrian Stratigraphy",,NA,NA,,,21,21,journal article,,
12393,ref,occ,C.,Beets,,,,1950,"Pliocene mollusca from a coral limestone of a hill near Sekoerau, E. Borneo",Leidse Geologische Mededelingen,,NA,NA,15,,305,318,journal article,,
9127,ref,occ,A. E.,Adams,,,,1984,"Development of algal-foraminiferal-coral reefs in the Lower Carboniferous of Furness, northwest England",Lethaia,,NA,NA,17,,233,249,journal article,English,
11109,ref,occ,I,Arua,M,Hoque,,1989,Predatory gastropod boreholes in an Eocene molluscan assemblage from Nigeria,Lethaia,,NA,NA,22,1,49,59,journal article,English,
846,ref,occ,S.,Bengtson,A.,Urbanek,,1986,"Rhabdotubus, a Middle Cambrian rhabdopleurid hemichordate",Lethaia,,NA,NA,19,,293,308,journal article,English,
857,ref,occ,V.,Berg-Madsen,,,,1986,"Middle Cambrian cystoid (sensu lato) stem columnals from Bornholm, Denmark",Lethaia,,NA,NA,19,1,67,80,journal article,English,
864,ref,occ,C. E.,Brett,W. D.,Liddell,K. L. Derstler,1983,Late Cambrian hard substrate communities from Montana/Wyoming: the oldest known hardground encrusters,Lethaia,,NA,NA,16,4,281,289,journal article,English,
3950,ref,occ,D.,Edwards,M. G.,Bassett,C. W. Rogerson,1979,The earliest vascular land plants: continuing the search for proof,Lethaia,,NA,NA,12,,313,324,journal article,English,
7185,ref,occ,J. A.,Fagerstrom,M. A.,Bradshaw,,2002,"Early Devonian reefs at Reefton, New Zealand: guilds, origin and paleogeographic significance",Lethaia,,NA,NA,35,1,35,50,journal article,English,
5596,ref,occ,C. S.,Feibel,,,,1994,"Freshwater stingrays from the Plio-Pleistocene of the Turkana Basin, Kenya and Ethiopia",Lethaia,,NA,NA,26,,359,366,,English,
859,ref,occ,M. F.,Glaessner,,,,1979,An echiurid worm from the Late Precambrian,Lethaia,,NA,NA,12,2,121,124,journal article,English,
6159,ref,occ,W.,Hansch,,,,1985,"Ostracode fauna, stratigraphy and definition of the Beyrichienkalk sequence",Lethaia,,NA,NA,18,4,273,282,journal article,English,
6149,ref,occ,D. A. T.,Harper,S. H.,Williams,,2002,A relict Ordovician brachiopod fauna from the Parakidograptus acuminatus Biozone (Lower Silurian) of the English Lake District,Lethaia,,NA,NA,35,1,71,78,journal article,English,
858,ref,occ,S.,Jensen,,,,1990,Predation by early Cambrian trilobites on infaunal worms - evidence from the Swedish Mickwitzia Sandstone,Lethaia,,NA,NA,23,1,29,42,journal article,English,
861,ref,occ,D. R.,Kobluk,N. P.,James,,1979,Cavity-dwelling organisms in Lower Cambrian patch reefs from southern Labrador,Lethaia,,NA,NA,12,3,193,218,journal article,English,
855,ref,occ,P. D.,Kruse,,,,1997,Hyolith guts in the Cambrian of northern Australia - turning hyolithomorphs upside down,Lethaia,,NA,NA,29,,213,217,journal article,English,
6161,ref,occ,L.,Liljedahl,,,,1985,Ecological aspects of a silicified bivalve fauna from the Silurian of Gotland,Lethaia,,NA,NA,18,1,53,66,journal article,English,
6155,ref,occ,E.,Mark-Kurik,,,,1969,Distribtion of vertebrates in the Silurian of Estonia,Lethaia,,NA,NA,2,2,145,152,journal article,English,
9214,ref,occ,J. M.,Martin,J. C.,Braga,P. Rivas,1989,Coral successions in Upper Tortonian reefs in SE Spain,Lethaia,,NA,NA,22,,271,286,journal article,English,
266,ref,occ,G. R.,McGhee,R. G.,Sutton,,1981,Late Devonian marine ecology and zoogeography of the central Appalachians and New York,Lethaia,,NA,NA,14,1,27,43,,English,
7004,ref,occ,D. G.,Mikulic,,,,1981,Trilobites in Paleozoic carbonate buildups,Lethaia,,NA,NA,14,1,45,56,journal article,English,
860,ref,occ,K. J.,Muller,,,,1983,Crustacea with preserved soft parts from the Upper Cambrian of Sweden,Lethaia,,NA,NA,16,2,93,109,journal article,English,
9352,ref,occ,C.,Perrin,,,,2000,"Changes of palaeozonation patterns within Miocene coral reefs, Gebel Abu Shaar, Gulf of Suez, Egypt",Lethaia,,NA,NA,33,,253,268,journal article,English,
867,ref,occ,V.,Poulsen,,,,1969,An Atlantic Middle Cambrian fauna from North Greenland,Lethaia,,NA,NA,2,,1,14,journal article,English,
856,ref,occ,B. R.,Pratt,,,,1998,Probable predation on Upper Cambrian trilobites and its relevance for the extinction of soft-bodied Burgess Shale-type animals,Lethaia,,NA,NA,31,,73,88,journal article,English,
854,ref,occ,H.,Siegmund,,,,1997,"The Ocruranus-Eohalobia group of small shelly fossils from Lower Cambrian of Yunnan, China - Sigmund 1997",Lethaia,,NA,NA,30,,285,291,journal article,English,
13446,ref,occ,K.,Tanabe,N.H.,Landman,"R.H. Mapes, C.J. Faulkner",1993,Analysis of a Carboniferous embryonic ammonoid assemblege--implications for ammonoid embryology,Lethaia,,NA,NA,26,,215,224,journal article,English,
13393,ref,occ,D. F.,Toomey,,,,1980,History of a Late Carboniferous phylloid algal bank complex in northeastern New Mexico.,Lethaia,,NA,NA,13,,249,267,journal article,English,
9171,ref,occ,D. F.,Toomey,J. M.,Cys,,1979,Community succession in small bioherms of algae and sponges in the Lower Permian of New Mexico,Lethaia,,NA,NA,12,,65,74,journal article,English,
3994,ref,occ,J.,Vannier,J. Y.,Chen,,2000,The Early Cambrian colonization of pelagic niches exemplified by Isoxys (Arthropoda),Lethaia,,NA,NA,33,4,295,311,journal article,English,
512,ref,occ,,Walossek,K. J.,Muller,,1989,A second type A-nauplius from the Upper Cambrian ''Orsten' of Sweden,Lethaia,,NA,NA,22,,301,306,,English,
510,ref,occ,D.,Walossek,I.,Hinz-Schallreuter,"J. H. Shergold, K. J. Muller",1993,Three-dimensional preservation of arthropod integument from the Middle Cambrian of Australia,Lethaia,,NA,NA,26,,7,15,,English,
513,ref,occ,D.,Walossek,H.,Szaniawski,,1991,"Cambrocaris baltica n. gen. n. sp., a possible stem-lineage crustacean from the Upper Cambrian of Poland",Lethaia,,NA,NA,24,,363,378,,English,
6158,ref,occ,R.,Watkins,,,,1975,Silurian brachiopods in a stromatoporoid bioherm,Lethaia,,NA,NA,8,1,53,61,journal article,English,
6635,ref,occ,A.D.,Wright,,,,1968,A westward extension of the upper Ashgillian Hirnantia fauna,Lethaia,,NA,NA,1,,352,367,journal article,English,
868,ref,occ,H.,Xianguang,J.,Bergstrom,,1994,Palaeoscolecid worms may be nematomorphs rather than annelids,Lethaia,,NA,NA,27,1,11,17,journal article,English,
12313,ref,occ,P.,Suveizdis,K. V.,Miklukho-Maklay,"L. B. Ukharskaya, I. P. Morozova, N. V. Glushenko, V. K. Ivanov, B. G. Podoba",1975,Permskaya sistema Pribaltiki (fauna i stratigrafiya). Permian deposits of the Baltic region (stratigraphy and fauna),"Lietuvos Geologijos Mokslinio Tyrimo Institutas, Trudy",,NA,NA,29,,305pp.,,serial monograph,,
2997,ref,occ,L. S.,Russell,,,,1967,"Palaeontology of the Swan Hills area, north-central Alberta","Life Science Contribution, Royal Ontario Museum",,NA,NA,71,,1,31,journal article,,
6640,ref,occ,R.,Ludvigsen,R. P.,Tripp,,1990,Silurian trilobites from the northern Yukon Territory,"Life Sciences Contributions, Royal Ontario Museum",,NA,NA,,153,1,59,serial monograph,,
13262,ref,occ,K.,Heißig,,,,1989,The faunal succession of the Bavarian Molasse reconsidered - correlation of the MN5 and MN6 faunas,"Lindsay, E. H., Fahlbusch, V. & Mein, P.: European Neogene Mammal Chronology. Nato ASI-series, Plenum Press; New York",,NA,NA,,,181,192,book/book chapter,,
6047,ref,occ,H. M. F.,Alvarenga,J. F.,Bonaparte,,1992,A new flightless landbird from the Cretaceous of Patagonia,"Los Angeles County Museum of Natural History, Science Series",,NA,NA,36,,51,64,journal article,English,
8636,ref,occ,M. G.,Leakey,J. M.,Harris,,2003,Lothagam: the dawn of humanity in eastern Africa,Lothagam: the dawn of humanity in eastern Africa,,NA,NA,,,678,,book/book chapter,,
7504,ref,occ,J. I.,Kirkland,,,,1998,A polacanthine ankylosaur (Ornithischia: Dinosauria) from the Early Cretaceous (Barremian) of eastern Utah,"Lower and Middle Cretaceous Terrestrial Ecosystems (S. G. Lucas, J. I. Kirkland, & J. W. Estep, eds.), New Mexico Museum of Natural History and Science Bulletin",,NA,NA,14,,271,281,book/book chapter,,
9056,ref,occ,O.,Sandström,S.,Kershaw,,2000,"Reef biostromes and related facies from the middle Silurian of Gotland, Sweden",Lund Publications in Geology,,NA,NA,148,4,1,11,Ph.D. thesis,English,
403,ref,occ,D. A.,Forbes,,,,1975,"Depositional History of the Ramp Creek Formation and Harrodsburg Limestone (Mississippian) Kinser Pike Section, Monroe County, Indiana","M.A. thesis, Indiana University",,NA,NA,,,1,100,,English,
825,ref,occ,R. Z.,Poore,,,,1969,The LeRoy Bioherm:  Onondaga Limestone (Middle Devonian) western New York,"M.S. thesis, Brown University",,NA,NA,,,1,69,M.S. thesis,English,
823,ref,occ,F. M.,"Swain, Jr.",,,,1939,Some Faunas from the Onondaga Formation in Central Pennsylvania and West Virginia,"M.S. thesis, Pennsylvania State University",,NA,NA,,,1,100,M.S. thesis,English,
12796,ref,occ,P. O.,Baumgartner,L.,O'Dogherty,"S. Gorican, R. Dumitrica-Jud, P. Dumitrica, A. Pillevuit, E. Urquhart, A. Matsuoka, T. Danelian, A. Bartolini, E. S. Carter, P. De Wever, N. Kito, M. Marcucci, T. Steiger",1995,Radiolarian catalogue and systematics of Middle Jurassic to Early Cretaceous Tethyan genera and species,Mémoires de Géologie (Lausanne),,NA,NA,23,,37,685,book/book chapter,,
13135,ref,occ,R.,Dumitrica-Jud,,,,1995,"Early Cretaceous Radiolarian Biostratigraphy of Umbria-Marche Apennines (Italy), Southern Alps (Italy and Switzerland) and Hawasina Nappes (Oman)",Mémoires de Géologie (Lausanne),,NA,NA,23,,751,790,book/book chapter,,
10348,ref,occ,R. E.,Molnar,,,,1980,Australian late Mesozoic continental tetrapods: some implications,"Mémoires de la Société Géologique de France, Nouvelle Série",,NA,NA,139,,131,143,journal article,,
3926,ref,occ,H.,Andrews,A.,Kasper,,1970,Plant fossils of the Trout Valley Formation,Maine Geological Survey Bulletin,,NA,NA,23,,3,16,journal article,English,
3432,ref,occ,H.,Tobien,,,,1972,"Status of the Genus Serridentinus Osborn 1923 (Proboscidea, Mammalia) and related forms",Mainzer Geowissenschaftliche Mitteilungen,,NA,NA,1,,143,191,journal article,,
3372,ref,occ,D. W.,Taylor,,,,1966,,Malacologia,,NA,NA,4,1,,,journal article,,
11127,ref,occ,A,David,,,,1999,"Predation by naticid gastropods on late Oligocene (Egerian) molluscs collected from Wind Brickyard, Eger, Hungary",Malakologiai Tajekoztato,,NA,NA,17,,11,19,journal article,,
5243,ref,occ,J. R. F.,Bower,C.M.,Nelson,,1977,"Early Pottery and Pastoral Cultures of the Central Rift Valley, Kenya",Man,,NA,NA,13,,554,66,,,
12100,ref,occ,A.,Jerzmanska,,,,1977,The freshwater fishes from the Middle Eocene of Geiseltal,"Martin-Luther-Universität Halle-Wittenberg, Wissenschaftliche Beiträge (P5)",,NA,NA,1977,2,41,65,journal article,,
488,ref,occ,J. J.,Klein,,,,1986,"Paleoecology of the Aguja formation, Brewster County, Texas","Masters thesis, Stephen F. Austin State University",,NA,NA,,,1,119,,,
4126,ref,occ,H. W.,Pfefferkorn,,,,1979,High diversity and stratigraphic age of the Mazon Creek flora (In M. Nitcki (ed.)),"Mazon Creek Fossils. University of Chicago Press, Chicago, IL USA",,NA,NA,,,129,142,serial monograph,,
12885,ref,occ,L. F.,Spath,,,,1930,The Eotriassic invertebrate fauna of East Greenland,Meddeleser om Grønland,,NA,NA,83,1,1,90,serial monograph,,
8788,ref,occ,S. J.,Dijkstra,,,,1951,Wealden Megaspores and their stratigraphical value,"Mededelingen Van de Geologische Stichting, Nieuwe Serie",,NA,NA,,5,7,22,journal article,,
8551,ref,occ,S. J.,Dijkstra,,,,1949,"Megaspores and some other fossils from the Aachenian (Senonian) in South Limburg, Netherlands","Mededelingen Van de Geologische Stichting, Niewe Serie",,NA,NA,,3,19,32,journal article,,
