reference_no,record_type,ref_type,author1init,author1last,author2init,author2last,otherauthors,pubyr,reftitle,pubtitle,editors,publisher,pubcity,pubvol,pubno,firstpage,lastpage,publication_type,language,doi
8194,ref,occ,K.Z.,Sal'menova,,,,1982,On the floristic relationships between the floras of the southern and eastern parts of the Angara region in the Early Permian,Paleontologicheskii Zhurnal (Paleontological Journal),,NA,NA,16,,1,7,journal article,English,
8198,ref,occ,L.I.,Savitskaya,,,,1969,Late Jurassic flora of Fergana,Paleontologicheskii Zhurnal (Paleontological Journal),,NA,NA,,1,135,138,journal article,English,
8254,ref,occ,V. G.,Zimina,,,,1967,Glossopteris and Gangamopteris from the Permian deposits of the South Maritime Territory,Paleontologicheskii Zhurnal (Paleontological Journal),,NA,NA,1,,98,106,journal article,English,
13416,ref,occ,A.,Afanasjeva,,,,1975,Chonetacea (Brachiopoda) from the Middle and Upper Carboniferous of the Russian platform.,Paleontologicheskiy Zhurnal,,NA,NA,1975,2,96,113,journal article,English,
13412,ref,occ,E. A.,Ivanova,,,,1975,Some Carboniferous Spiriferinidina (Brachiopoda) of the Moscow Basin.,Paleontologicheskiy Zhurnal,,NA,NA,1975,2,79,88,journal article,English,
892,ref,occ,I. N.,Krasilova,,,,1977,Fordillidae (Bivalvia) from the Lower Paleozoic of the Siberian Platform,Paleontologicheskiy Zhurnal,,NA,NA,11,2,172,178,journal article,English,
13415,ref,occ,S.,Lazarev,,,,1975,Middle- and Late Carboniferous Stenoscismatacea (Brachiopoda) of the Moscow syneclise.,Paleontologicheskiy Zhurnal,,NA,NA,1975,2,89,95,journal article,English,
13376,ref,occ,I. P.,Morozova,D. V.,Lisitsyn,,2002,A Revision of Bryozoans from the Stratotype Sections of the Gzhelian Stage (Upper Carboniferous).,Paleontologicheskiy Zhurnal,,NA,NA,2002,6,63,72,journal article,English,
13272,ref,occ,V. I.,Poletaev,,,,2000,Donispirifer and Tegulispirifer - New Middle to Late Carboniferous Spiriferids from Eurasia.,Paleontologicheskiy Zhurnal,,NA,NA,2000,3,50,57,journal article,English,
899,ref,occ,Ye. U.,Romanenko,,,,1984,Trilobites from the Middle-Upper Cambrian boundary beds of Altai,Paleontologicial Journal,,NA,NA,19,4,64,74,journal article,English,
8773,ref,occ,O. F.,Lazutkina,,,,1963,Discovery of a bryozoan of the Paleozoic genus Batostomella in the Triassic,Paleontologiskii Zhurnal,,NA,NA,4,,126,128,journal article,English,
4231,ref,occ,P. J.,Lesperance,P.M.,Sheehan,,1976,"Brachiopods from the Hirnantian Stage (Ordovician-Silurian) at Perce, Quebec",Paleontology,,NA,NA,19,4,719,731,journal article,English,
11619,ref,occ,J.,Hall,,,,1847,Containing descriptions of the organic remains of the lower division of the New York system (equivalent of the Lower Silurian rocks of Europe),Paleontology of New York,,NA,NA,1,,1,338,serial monograph,English,
8273,ref,occ,X.W.,Wu,,,,1982,Late Triassic plants from eastern Xizang,Paleontology of Tibet,,NA,NA,,5,63,103,book/book chapter,English,
8274,ref,occ,X.W.,Wu,,,,1982,"Fossil plants from the Upper Triassic Tumaingela Formation in Amdo-Baqen area, northern Xizang",Paleontology of Tibet,,NA,NA,5,,45,59,book/book chapter,English,
3995,ref,occ,J. E.,Canright,,,,1978,A Late Paleozoic Flora from Promontory Butte in Central Arizona,"Paleontology, Stratigraphy, and Vegetation in East-Central Arizona: American Association of Stratigraphic Palynologists 11th Annual Meeting",,NA,NA,,,25,30,,English,
12322,ref,occ,H.,Liu,P.,Chow,,1959,"Mammalian fossils from the Pliocene of Lushi, Henan",Paleovertebrata et Paleoanthropologia (Gujizhui dongwu yu gurenlei),,NA,NA,1,2,73,79,journal article,,
8750,ref,occ,P,Carls,,,,1973,"Strophomenids of the Lower Devonian Kartal Formation, Istanbul","Paleozoic of Istanbul Ege universitesi, Fen fakultesi, Kitaplar Serisi, Jeol",,NA,NA,40,,90,94,,,
8757,ref,occ,J,Gandl,,,,1973,Trilobites from the Devonian of Istanbul,"Paleozoic of Istanbul Ege universitesi, Fen fakultesi, Kitaplar Serisi, Jeol",,NA,NA,40,,95,96,journal article,,
8751,ref,occ,O,Kaya,,,,1973,"The Devonian and Lower Carboniferous stratigraphy of the Istinye, Bostanci, and Buyukada subareas","Paleozoic of Istanbul Ege universitesi, Fen fakultesi, Kitaplar Serisi, Jeol",,NA,NA,40,,1,36,journal article,,
8779,ref,occ,J.,Kullmann,,,,1973,"Goniatite-Coral associations from the Devonian of Istanbul, Turkey","Paleozoic of Istanbul Ege universitesi, Fen fakultesi, Kitaplar Serisi, Jeol",,NA,NA,40,,97,116,journal article,,
8752,ref,occ,C,Babin,,,,1973,"Bivalvia of the Kartal Formation of Devonian age, Istanbul","Paleozoic of Istanbul, Ege universitesi, Fen fakultesi, Kitaplar Serisi, Jeol",,NA,NA,40,,37,89,journal article,,
11302,ref,occ,M,Iordan,,,,1975,Preliminary Study of Some Upper Triassic Brachiopods from the Frunzar-Comana Valley (Persani Mountains),Paleozoologie,,NA,NA,62,,47,52,journal article,,
3645,ref,occ,M. R.,Williams,J. E.,Storer,,1998,Cricetid rodents of the Kealey Springs Local Fauna (early Arikareean; late Oligocene) of Saskatchewan,Paludicola,,NA,NA,1,4,143,149,journal article,,
7148,ref,occ,Y.,Grahn,,,,1992,Revision of Silurian and Devonian strata of Brazil,Palynology,,NA,NA,16,,35,61,journal article,English,
4067,ref,occ,W. A.,Gregory,G. F.,Hart,,1995,Distribution of pollen and spores in a subsurface marine Wilcox (Paleocene-Eocene) section in southwest Louisiana,Palynology,,NA,NA,19,,1,43,journal article,English,
8992,ref,occ,E.,Koppelhus,D. J.,Batten,,1989,Late Cretaceous megaspores from Southern Sweden: Morphology and paleoenvironmental significance,Palynology,,NA,NA,13,,91,120,journal article,English,
8778,ref,occ,W. L.,Kovach,D. L.,Dilcher,,1988,"Megaspores and other dispersed plant remains from the Dakota Formation (Cenomanian) of Kansas, U.S.A.",Palynology,,NA,NA,12,,89,119,journal article,English,
454,ref,occ,J. S.,Jell,D.,Hill,,1969,"The Devonian Coral Fauna of the Point Hibbs Limestone, Tasmania",Papers and Proceedings of the Royal Society of Tasmania,,NA,NA,104,,1,16,,,
8008,ref,occ,W. D.,Tidwell,J.H.,Kern,T. Kimura,1987,"Mid-Mesozoic leaves from near Ida Bay, southern Tasmania, Australia",Papers and Proceedings of the Royal Society of Tasmania,,NA,NA,121,,159,170,journal article,,
8180,ref,occ,J. A.,Townrow,,,,1964,Speculation of the Rhaeto-Liassic climate of Tasmania,Papers and Proceedings of the Royal Society of Tasmania,,NA,NA,98,,113,118,journal article,,
2621,ref,occ,G. S.,Morgan,R. B.,Ridgway,,1987,"Late Pliocene (late Blancan) vertebrates from the St. Petersburg Times site, Pinellas County, Florida, with a brief review of Florida Blancan faunas",Papers in Florida Paleontology,,NA,NA,1,,1,22,journal article,English,
1869,ref,occ,C. W.,Hibbard,,,,1953,The Saw Rock Canyon fauna [Kansas] and its stratigraphic significance,"Papers of the Michigan Academy of Science, Arts, and Letters",,NA,NA,38,,387,411,journal article,English,
1887,ref,occ,C. W.,Hibbard,,,,1963,A late Illinoian fauna from Kansas and its climatic significance,"Papers of the Michigan Academy of Science, Arts, and Letters",,NA,NA,48,,187,221,journal article,English,
1889,ref,occ,C. W.,Hibbard,,,,1964,,"Papers of the Michigan Academy of Science, Arts, and Letters",,NA,NA,49,,,,journal article,English,
13525,ref,occ,J. H.,Ostrom,,,,1970,"Stratigraphy and paleontology of the Cloverly Formation (Lower Cretaceous) of the Bighorn Basin area, Wyoming and Montana",Peabody Museum Bulletin,,NA,NA,35,,1,234,journal article,English,
3520,ref,occ,K. M.,Waage,,,,1968,,Peabody Museum of Natural History Bulletin,,NA,NA,27,,,,journal article,English,
841,ref,occ,R. L.,Ellison,,,,1965,Stratigraphy and Paleontology of the Mahantango Formation in south-central Pennsylvania,Pennsylvania Geological Survey Bulletin G48,,NA,NA,,,1,298,book/book chapter,English,
8320,ref,occ,,Bur. of Geol. and Min. Resources of Jiangsu,,,,1984,Regional geology of Jiangsu Province and Shanghai Municipality,"People's Republic of China Ministry of Geology and Mineral Resources, Geological Memoirs",,NA,NA,1,1,1,857,book/book chapter,English,
11624,ref,occ,C. B.,Neri,M.,Pasini,R. Posenato,1986,"The Permian/Triassic boundary and the Early Scythian sequence - Tereso section, Dolomites",Permian and Permian-Triassic Boundary in the South-Alpine Segement of the Western Tethys - IGCP Project No. 203,,NA,NA,,,111,116,guidebook,English,
8185,ref,occ,J. F.,Rigby,,,,1983,The role of the Glossopteris flora in biostratigraphy--a preliminary assessment in the Reids Dome Beds,"Permian Geology of Queensland. Geological Society of Australia, Queensland Division, Brisbane, Australia",,NA,NA,,,221,229,book/book chapter,English,
11693,ref,occ,V.,Khuc,,,,2000,The Triassic of Indochina Peninsula and its interregional correlation,Permian-Triassic Evolution of Tethys and Western Circum-Pacific,,NA,NA,,,221,233,book/book chapter,English,
13574,ref,occ,G. T.,Forsythe,,,,2003,A new synthesis of Permo-Carboniferous phylloid algal reef ecology,"Permo-Carboniferous carbonate platforms and reefs, SEPM Special Publication",,NA,NA,78,,171,188,book/book chapter,English,
13573,ref,occ,M.,Aretz,H.-G.,Herbig,,2003,Contribution of rugose corals to late Viséan and Serpukhovian bioconstructions in the Montagne Noire (southern France),Permo-Carboniferous carbonate platforms and reefs. SEPM Special Publication,,NA,NA,78,,119,132,book/book chapter,English,
13576,ref,occ,E.,Samankassou,,,,2003,"Upper Carboniferous–Lower Permian buildups of the Carnic Alps, Austria–Italy",Permo-Carboniferous carbonate platforms and reefs. SEPM Special Publication,,NA,NA,78,,201,217,book/book chapter,English,
4428,ref,occ,S. L.,Wing,,,,1990,personal research,personal research,,NA,NA,,,,,,,
4239,ref,occ,N. H.,Foster,,,,1963,Faunal Zonation and Stratigraphy of the Mississippian Madison Group: Wyoming and Montana,Ph.D. dissertation at Univeristy of Kansas,,NA,NA,,,,,Ph.D. thesis,English,
8374,ref,occ,E. A.,Kowalski,,,,2001,"Middle to late Miocene environments of southern Ecuador: temperature, elevation and fossil plants of the Nabon Basin.","Ph.D. Dissertation, Geological Sciences, University of Michigan",,NA,NA,,,1,437,Ph.D. thesis,English,
830,ref,occ,H. R.,Feldman,,,,1978,Brachiopods and Community Ecology of the Onondaga Limestone,"Ph.D. thesis, Rutgers University",,NA,NA,,,1,203,Ph.D. thesis,English,
4760,ref,occ,H. L.,Schwartz,,,,1983,"Paleoecology of Late Cenozoic Fishes from the Turkana Basin, Northern Kenya","PhD Dissertation, University of California, Santa Cruz",,NA,NA,,,,,,English,
12453,ref,occ,D. I.,Whiteside,,,,1986,The head skeleton of the Rhaetian sphenodontid Diphydontosaurus avonis gen. et sp. nov. and the modernizing of a living fossil,"Philisophical Transactions of the Royal Society of London, Series B",,NA,NA,312,,379,430,journal article,English,
10789,ref,occ,M.,Hastings,,,,1853,"On the Tertiary Beds of Hordwell, Hampshire","Philosophical Magazine and Journal of Science, Fourth Series",,NA,NA,6,36,1,11,journal article,English,
4070,ref,occ,W. N.,Croft,W. H.,Lang,,1942,The Lower Devonian flora of the Senni Beds of Monmouthsire and Breconshire,Philosophical Transactions of the Royal Society of Britain,,NA,NA,221,,131,163,journal article,English,
7427,ref,occ,J. W.,Hulke,,,,1881,"<i>Polacanthus foxii</i>, a large undescribed dinosaur from the Wealden Formation in the Isle of Wight",Philosophical Transactions of the Royal Society of London,,NA,NA,172,,653,662,journal article,English,
13427,ref,occ,A. M.,Lister,J. M.,McGlade,,1990,"The Early Middle Pleistocene vertebrate fauna from Little Oakley, Essex",Philosophical Transactions of the Royal Society of London B,,NA,NA,328,,359,385,journal article,English,
9482,ref,occ,E. T.,Newton,,,,1894,Reptiles from the Elgin Sandstone. — Description of two new genera,Philosophical Transactions of the Royal Society of London B,,NA,NA,185,,573,607,journal article,English,
13428,ref,occ,A. J.,Stuart,,,,1980,The vertebrate fauna from the interglacial deposits at Sugworth near Oxford,Philosophical Transactions of the Royal Society of London B,,NA,NA,289,,87,97,journal article,English,
3957,ref,occ,D.,Edwards,U.,Fanning,,1985,Evolution and environment in the late Silurian-early Devonian: the rise of the pteridophytes,"Philosophical Transactions of the Royal Society of London, B",,NA,NA,309,,147,165,journal article,English,
561,ref,occ,R. M. C.,Eagar,,,,1977,Some new Namurian bivalve faunas and their significance in the origin of Carbonicola and in the colonization of Carboniferous deltaic environments,Philosophical Transactions of the Royal Society of London. Series B - Biological Sciences,,NA,NA,280,,535,570,,English,
8366,ref,occ,A.,Hallam,,,,1960,A sedimentary and faunal study of the Blue Lias of Dorset and Glamorgan,"Philosophical Transactions of the Royal Society, London",,NA,NA,243,,1,44,journal article,English,
5671,ref,occ,J. L.,Franzen,,,,1985,Exceptional preservation of Eocene vertebrates in the lake deposits of Grube Messel (West Germany),"Philosophical Transactions of the the Royal Society, London, B",,NA,NA,311,,181,186,,English,
8831,ref,occ,S. H.,Mamay,,,,1988,Gigantonoclea in the Lower Permian of Texas,Phytologia,,NA,NA,64,,330,332,,English,
8832,ref,occ,S. H.,Mamay,,,,1986,New species of Gigantopteridaceae,Phytologia,,NA,NA,61,,311,315,journal article,English,
7775,ref,occ,S.,Magallon-Puebla,P. S.,Herendeen,P. K. Endress,1996,Allonia decandra: Floral remains of the tribe Hamamelideae (Hamamelidaceae) from Campanian strata of southeastern USA,Plant Systematics and Evolution,,NA,NA,202,,177,198,journal article,English,
8500,ref,occ,S.,Magallon-Puebla,P. S.,Herendeen,P. K. Endress,1996,Allonia decandra: floral remains of the tribe Hamamelideae (Hamamelidaceae) from Campanian strata of southeastern USA,Plant Systematics and Evolution,,NA,NA,202,,177,198,journal article,English,
5379,ref,occ,T.,Harrison,,,,1997,"Neogene Paleontology of the Manonga Valley, Tanzania A Window into the Evolutionary History of east Africa","Plenum Press, New York and London.",,NA,NA,,,,,,English,
8474,ref,occ,A.,Mørk,G.,Elvebakk,"A.W. Forsberg, M.W. Hounslow, H.A. Nakrem, J.O. Vigran, W. Weitschat",1999,The type section of the Vikinghøgda Formation: a new Lower Triassic unit in central and eastern Svalbard,Polar Research,,NA,NA,18,1,51,82,journal article,English,
13335,ref,occ,R.,Wrona,,,,2003,"Early Cambrian molluscs from glacial erratics of King George Island, West Antarctica",Polish Polar Research,,NA,NA,24,03-Apr,181,216,journal article,English,
8879,ref,occ,P. L.,Binda,E.M.V.,Nambudiri,,1988,"Two new species of Erlansonisporites from the Whitemud Formation (Maastrichtian), Alberta, Canada",Pollen et Spores,,NA,NA,30,2,231,242,journal article,English,
8491,ref,occ,T. A.,Bond,,,,1968,"Permian palynological assemblage from the Wellington Formation Kay County, Oklahoma.",Pollen et Spores,,NA,NA,10,2,385,393,journal article,English,
8965,ref,occ,W. C.,Elsik,,,,1967,New sporomorph genera from the Upper Cretaceous of Peru,Pollen et Spores,,NA,NA,8,3,553,564,journal article,English,
8967,ref,occ,P.,Gunther,L. V.,Hills,,1970,Heterospory in Ariadnaesporites,Pollen et Spores,,NA,NA,12,1,123,130,journal article,English,
8771,ref,occ,J. W.,Hall,,,,1963,"Megaspores and other fossils in the Dakota Formation (Cenomanian) of Iowa, (U.S.A.)",Pollen et Spores,,NA,NA,5,2,425,443,journal article,English,
8968,ref,occ,J. W.,Hall,,,,1967,Two new species of Ariadnaesporites,Pollen et Spores,,NA,NA,9,3,563,568,journal article,English,
8785,ref,occ,S. K.,Srivastava,,,,1966,"Upper Cretaceous microflora (Maestrichtian) from Scollard, Alberta, Canada",Pollen et Spores,,NA,NA,8,3,497,552,journal article,English,
6902,ref,occ,T.,Delevoryas,R. C.,Hope,,1971,A new Triassic cycad and its phyletic implications,Postilla,,NA,NA,,150,1,21,journal article,English,
3161,ref,occ,G. G.,Simpson,,,,1968,A didelphid (Marsupialia) from the Early Eocene of Colorado,Postilla,,NA,NA,115,,1,3,journal article,English,
3184,ref,occ,B. H.,Slaughter,,,,1965,A therian from the Lower Cretaceous (Albian) of Texas,Postilla,,NA,NA,93,,1,18,journal article,English,
7838,ref,occ,W,Szafer,,,,1961,Miocenska Flora ze Starych Gliwic na Slasku (Miocene Flora of Stare Gliwice in Upper Silesia),Prace Instytut Geologiczny,,NA,NA,33,,1,205,serial monograph,,
6381,ref,occ,F,Prantl,,,,1940,Ordovicke a silurske mechovky z Montagne Noire (Languedock); Some Ordovician and Silurian Bryozoa from Montagne Noire (Languedock),"Praha (Prague), Nar. Mus., Sbornik, Geol. et Pal., 2B",,NA,NA,4,,81,104,journal article,,
416,ref,occ,G. J. B.,Germs,,,,1995,"The Neoproterozoic of southwestern Africa, with emphasis on platform stratigraphy and paleontology",Precambrian Research,,NA,NA,73,,137,151,,English,
422,ref,occ,S.,Weiguo,,,,1986,Precambrian mudusoids:the Cyclomedusa plexus and Cyclomedusa-like pseudofossils,Precambrian Research,,NA,NA,31,,325,360,,English,
423,ref,occ,S.,Weiguo,,,,1986,"Late Precambrian Pennatulids (sea pens) from the Eastern Yangtze Gorge, China: Paracharnia gen. nov",Precambrian Research,,NA,NA,31,,361,375,,English,
3905,ref,occ,S.,Weiguo,,,,1986,"Macroscopic worm-like body fossils from the Upper Precambrian (900-700 Ma), Huainan District, Anhui China and their stratigraphic and evolutionary significance",Precambrian Research,,NA,NA,31,,377,403,journal article,English,
5608,ref,occ,A.,Petter,F.K.,Jouffroy,,1993,Fiber type population in limb muscles of Microcebus murinus,Primatates,,NA,NA,34,2,181,196,,English,
12216,ref,occ,A.,Riabinin,,,,1938,Microzeuglodon aff. caucasicum Lyd. from the Upper Maikop beds of Kabristan,Problems of Paleontology,,NA,NA,4,,137,185,journal article,English,
9525,ref,occ,J. H.,Callomon,,,,1979,Marine boreal Bathonian fossils from the northern North Sea and their palaeogeographical significance,Proceeding of the Geologists' Assosciation,,NA,NA,90,4,163,169,journal article,English,
8431,ref,occ,K.-P.,Kelber,J.H.A.,van Konijnenburg-van Cittert,,1997,A new Rhaetian flora from the neighbourhood of Coburg (Germany) - preliminary results.,Proceedings 4th EPPC,,NA,NA,58,,105,114,journal article,English,
9209,ref,occ,E. H.,Colbert,,,,1948,A hadrosaurian dinosaur from New Jersey,Proceedings of the Academy of Natural Sciences of Philadelphia,,NA,NA,100,,23,37,journal article,English,
11886,ref,occ,J.,Leidy,,,,1868,Notice of some extinct cetaceans,Proceedings of the Academy of Natural Sciences of Philadelphia,,NA,NA,1868,,196,197,journal article,English,
11897,ref,occ,J.,Leidy,,,,1859,[Remarks on Dromatherium sylvestre and Ontocetus emmonsi],Proceedings of the Academy of Natural Sciences of Philadelphia,,NA,NA,1859,,162,,journal article,English,
12329,ref,occ,J.,Leidy,,,,1851,"[Descriptions of two fossil speceis of Balaena, B. palaeatlantica and B. prisca]",Proceedings of the Academy of Natural Sciences of Philadelphia,,NA,NA,5,,308,309,journal article,English,
12638,ref,occ,J.,Leidy,,,,1876,Remarks on fossils from the Ashley Phosphate Beds,Proceedings of the Academy of Natural Sciences of Philadelphia,,NA,NA,1876,,80,81,journal article,English,
13001,ref,occ,J.,Leidy,,,,1852,[Description of Emys culbertsonii],Proceedings of the Academy of Natural Sciences of Philadelphia,,NA,NA,6,,34,,journal article,English,
13003,ref,occ,J.,Leidy,,,,1858,[On the bones of a huge herbivorous saurian near Haddonfield],Proceedings of the Academy of Natural Sciences of Philadelphia,,NA,NA,10,,215,218,journal article,English,
13005,ref,occ,J.,Leidy,,,,1853,[Fragment of a jaw of an extinct saurian animal],Proceedings of the Academy of Natural Sciences of Philadelphia,,NA,NA,6,,404,,journal article,English,
12244,ref,occ,O. C.,Marsh,,,,1870,On a number of vertebrae of a new Dinosaurian from the Cretaceous green sand near Barnsboro,Proceedings of the Academy of Natural Sciences of Philadelphia,,NA,NA,22,,2,3,journal article,English,
3155,ref,occ,G. G.,Simpson,,,,1951,"Hayden, Cope, and the Eocene of New Mexico","Proceedings of the Academy of Natural Sciences, Philadelphia",,NA,NA,103,,1,21,journal article,English,
10195,ref,occ,C. T.,Brues,,,,1923,Some New Fossil Parasitic Hymenoptera from Baltic Amber,Proceedings of the American Academy of Arts and Sciences,,NA,NA,58,8,327,346,journal article,English,
12635,ref,occ,E. D.,Cope,,,,1875,"Synopsis of the Vertebrata of the Miocene of Cumberland County, New Jersey",Proceedings of the American Philosophical Society,,NA,NA,14,,361,364,journal article,English,
3167,ref,occ,W. J.,Sinclair,,,,1922,Entelodonts from the Big Badlands of South Dakota in the geological museum of Princeton University,Proceedings of the American Philosophical Society,,NA,NA,60,,467,495,journal article,English,
3169,ref,occ,W. J.,Sinclair,,,,1922,Hyracodons from the Big Badlands of South Dakota,Proceedings of the American Philosophical Society,,NA,NA,61,,65,79,journal article,English,
10905,ref,occ,M.,Sone,M. S.,Leman,,2000,"Some mid-Permian fossils from Felda Mayam, Central Peninsular Malaysia",Proceedings of the Annual Geological Congress of Malaysia,,NA,NA,,,143,149,serial monograph,English,
1437,ref,occ,R. J.,Emry,,,,1979,Review of Toxotherium (Perissodactyla: Rhinocerotoidea) with new material from the early Oligocene of Wyoming,Proceedings of the Biological Society of Washington,,NA,NA,92,1,28,41,journal article,English,
10485,ref,occ,J. B.,Hatcher,,,,1903,A new sauropod dinosaur from the Jurassic of Colorado,Proceedings of the Biological Society of Washington,,NA,NA,16,,1,2,journal article,English,
11898,ref,occ,C. E.,Ray,,,,1975,The relationshiops of Hemicaulodon effodiens Cope 1869 (Mammalia; Odobenidae),Proceedings of the Biological Society of Washington,,NA,NA,88,26,282,304,journal article,English,
12162,ref,occ,R.,Kellogg,,,,1931,"Pelagic mammals of the Temblor Formation of the Kern River region, California",Proceedings of the California Academy of Science,,NA,NA,19,12,217,397,journal article,English,
11604,ref,occ,R. D.,Hoare,,,,2000,Silurian Polyplacophora and Rostroconchia (Mollusca) from Northern California,Proceedings of the California Academy of Sciences,,NA,NA,52,3,23,31,journal article,English,
12464,ref,occ,C. V.,Zeigler,G. L.,Chan,L. G. Barnes,1997,"A new late Miocene balaenopterid whale (Cetacea: Mysticeti), Parabalaenoptera baulinensis, (new genus and species) from the Santa Cruz Mudstone, Point Reyes Peninsula, California",Proceedings of the California Academy of Sciences,,NA,NA,50,4,115,138,journal article,English,
10823,ref,occ,T.,Wright,,,,1852,Contributions to the palaeontology of the Isle of Wight,Proceedings of the Cottleswold Naturalist's Field Club,,NA,NA,,,229,234,journal article,English,
3652,ref,occ,T. E.,Williamson,S. G.,Lucas,R. K. Stucky,1996,,Proceedings of the Denver Museum of Natural History,,NA,NA,3,13;1-3,,,journal article,English,
8336,ref,occ,P. C.,Ensom,,,,1987,A remarkable new vertebrate site in the Purbeck Limestone Formation on the Isle of Purbeck,Proceedings of the Dorset Natural History and Archaeological Society,,NA,NA,108,,205,206,journal article,English,
10373,ref,occ,C.,Van der Vyver,,,,1985,An ammonite fauna preserved in rock fragments dredged from Lyme Bay,Proceedings of the Dorset Natural History and Archaeological Society,,NA,NA,106,,168,169,journal article,English,
10070,ref,occ,L.,Hints,,,,1998,Oandu stage (Caradoc) in central North Estonia,Proceedings of the Estonian Academy of Science,,NA,NA,47,3,158,172,journal article,English,
12309,ref,occ,A. V.,Zhuravlev,,,,1999,"Conodonts of the Polygnathus pollocki Druce group (Upper Devonian, Lower Frasnian) from the East European Platform",Proceedings of the Estonian Academy of Sciences. Geology.,,NA,NA,48,1,35,47,journal article,English,
6573,ref,occ,M.C.,Hewitt,R. J.,Cuffey,,1985,"Lichenaliid-Fistuliporoid crust-mounds (Silurian, New York-Ontario), typical early Paleozoic bryozoan reefs","Proceedings of the Fifth International Coral Reef Congress, Tahiti",,NA,NA,6,,,,serial monograph,English,
4296,ref,occ,W. H.,Gillespie,G.J.,Hennen,C. Balasco,1975,Plant Megafossils from Dunkard Strata in Northwestern West Virginia and Southwestern Pennsylvania,"Proceedings of the First I.C. White Memorial Symposium ""The Age of the Dunkard""",,NA,NA,,,,,journal article,English,
8767,ref,occ,T. E.,Bolton,,,,1962,Additional Arcticopora from the Triassic of Northwestern Ellesmere Island.,Proceedings of the Geological Association of Canada,,NA,NA,13,,55,59,journal article,English,
8766,ref,occ,M. A.,Fritz,,,,1962,"A new bryozoan genus from Lake Hazen, Northeastern Ellesmere Island",Proceedings of the Geological Association of Canada,,NA,NA,13,,53,54,journal article,English,
12787,ref,occ,T. H.,Huxley,,,,1864,"On the cetacean fossils termed Ziphius by Cuvier, with a notice of a new species (Belemnoziphius compressus) from the Red Crag",Proceedings of the Geological Society,,NA,NA,20,,388,396,journal article,English,
3983,ref,occ,A. C.,Scott,D.,Edwards,W. D. I. Rolfe,1976,"Fossiliferous Lower Old Red Sandstone near Cardross, Dumbartonshire",Proceedings of the Geological Society of Glasgow,,NA,NA,117,,4,5,journal article,English,
7909,ref,occ,D.,Ager,V.,,,1955,The geographical distribution of brachiopods in the British Middle Lias,Proceedings of the Geologists Association,,NA,NA,65,,157,187,journal article,English,
8613,ref,occ,D. J.,Batten,,,,1974,Wealden Palaeoecology from the Distribution of Plant Fossils,Proceedings of the Geologists' Association,,NA,NA,85,4,433,458,journal article,English,
9528,ref,occ,L.,Beauvais,P.,Negus,,1975,The Fairford coral beds,Proceedings of the Geologists' Association,,NA,NA,86,,183,204,journal article,English,
13293,ref,occ,M.L.K.,Curtis,,,,1972,"The Silurian rocks of the Tortworth Inlier, Gloucestershire",Proceedings of the Geologists' Association,,NA,NA,83,1,1,35,,English,
